<?xml version="1.0" encoding="utf-8" ?>
<letter 
    xmlns:xsi="http://www.w3.org/2001/XMLSchema-instance" 
    xsi:noNamespaceSchemaLocation="lettera-schema.xsd"
    to="Bob"
    from="Janet"
    date="1980-06-03">
    <object>Notice me sempai UwU</object>
    <formalGreeting>Hi, lil' baka :3</formalGreeting>
    <body>
        <paragraph>Don't forget me this weekend :C</paragraph>
        <paragraph>PLSSSS (SIGMA BALLS)</paragraph>
    </body>
    <closingStatement>Bacio Davide in bocca X_X</closingStatement>
    <signature>SCKBoy</signature>
</letter>